author,name,num_comments,score,subreddit,title
cbppbc,t3_89ljff,286,6729,UnethicalLifeProTips,"ULPT: If you're having trouble affording food, make your girlfriend get tinder dates to pay for her meals so you can eat the leftovers later."
finendandie,t3_7zm6ju,135,6708,UnethicalLifeProTips,"ULPT : When coordinating to meet another party in a private sale say that you live double the distance so that when you meet ""half way"" you're already there."
cn2092,t3_7zs9k4,176,6696,UnethicalLifeProTips,"ULPT: Any time you see someone texting and driving, lay on your horn. They'll get startled and swerve off the road, making the streets safer for everyone else."
reddit25,t3_7p7gnp,241,6683,UnethicalLifeProTips,ULPT: People street racing around your neighborhood at night? Go on Waze and report a police officer in your street.
ZunaCorpLX,t3_9iy9m4,166,6663,UnethicalLifeProTips,"ULPT: If you accidentally answer a call from someone you don?t want to talk to, say hello. Then say hello 2 more times in a questionable manner spaced 3 seconds apart as they talk. Hang up."
The_Nightman_82,t3_apy7np,339,6655,UnethicalLifeProTips,"ULPT: when flying Southwest, put your coat or other belongings on the seat next to you and tell people that ask if the seat is taken that the person sitting there is in the bathroom"
HelloThisIs911,t3_76dtyq,375,6648,UnethicalLifeProTips,ULPT: Carry a police radio scanner with you all the time. It will come in handy.
superchet,t3_7er19b,142,6644,UnethicalLifeProTips,"ULPT: When your children are young, tell them that when they lie a vein pops up in the middle of their forehead. When they are lying to you, they will subconsciously cover their forehead with their hand and you will instantly be aware of their dishonesty!"
FantasyMaster85,t3_b6bnf2,144,6628,UnethicalLifeProTips,"ULPT: Periodically leave some cold medicine (DayQuil, TheraFlu, etc) on your desk in plainly visible view of your boss/coworkers. To those who (inevitably) ask how you feel, explain you'll be fine. Your boss will be impressed you came to work sick, then when you call off nobody suspects *anything*"
atticuslodius,t3_7bm2uj,140,6633,UnethicalLifeProTips,ULPT: Gift your roommate a soap dispenser for their bathroom that is identical to yours. When you run out of soap then switch the dispensers so they will have to refill it.
cannabiscouple252,t3_b7vep5,425,6619,UnethicalLifeProTips,ULPT Save around $80 per person when you fly with 3 bags of candy at the airport. Sometimes results in upgrades as well.
Rothaga,t3_86xjcd,253,6597,UnethicalLifeProTips,ULPT Lost/broke your mobile device charger? Just call a nearby hotel and say you left it on your recent stay. They almost always have a bin full of chargers and usually don't ask any verification questions.
andybuxx,t3_ase2lt,101,6594,UnethicalLifeProTips,ULPT. Occupy small children for hours by hiding four sweets in their bedroom and telling them you have hidden five.
Chordstrike1994,t3_8asqd5,486,6593,UnethicalLifeProTips,"ULPT: Want free coconut/almond/soy milk in your starbucks coffee? Order your drink w/o milk and pay for it, and then act like you forgot to ask for it. ""I'm so sorry, is it too late to put soy milk in it?"" Works 10/10 times."
septimus29,t3_822ori,214,6558,UnethicalLifeProTips,"ULPT: If you want a PS4/Xbox One on the cheap, check Craigslist/eBay around the time that semester report cards come out."
Nairtales,t3_9b7xqp,217,6557,UnethicalLifeProTips,"ULPT : if you are eating pizza with others, always pick a slice first - if it turns out to be smaller than you expected, pass it on to the person next to you with a smile. You get to pick again AND come across as a nice person."
AD_1172,t3_98wcl9,167,6542,UnethicalLifeProTips,ULPT: Want to impress a date? Take him/her to an escape room you have been through before and already know all the solutions.
SadisticPandadog,t3_7za1m1,164,6524,UnethicalLifeProTips,"ULPT: If you commute by motorcycle, have pink or purple on your clothes, helmet, or backpack. Cars will be more likely to move aside for you if they think you're female, but doesn't work if you're fat."
themenace117,t3_7x0bul,163,6496,UnethicalLifeProTips,"ULPT: Have some rowdy children who want to play? Tell them that you're all going to play hide and seek and that you'll be ""it"". Once you finish your countdown don't go anywhere and just enjoy your peace and quiet."
jrtaylor01,t3_9byeu4,148,6484,UnethicalLifeProTips,"ULPT: Have a tattoo of an ex?s name and can?t afford the expensive tattoo removal fee? Get a cheap gang tattoo over it, and find someone who helps ex-gang members remove it for free."
Candybar121,t3_649jx6,153,6394,UnethicalLifeProTips,"ULPT: Trying to stream a TV show or movie online, but can't find any good sources? Scroll all the way to the bottom of your google search, and if there were any results removed due to copyright, click on ""read the DMCA complaint"" to see the exact URL that was taken down."
sndu32,t3_8cbkcb,248,6392,UnethicalLifeProTips,ULPT: Spill drink in the seat in front of you at the movies to avoid people blocking your view
naked_dev,t3_77z4tz,108,6364,UnethicalLifeProTips,ULPT: Copy your superior's LinkedIn information and apply him at different companies. Maybe he gets an offer and change company and you get his position at your current company.
SonicMaze,t3_8hm6am,172,6343,UnethicalLifeProTips,"ULPT: Take a screenshot of your incoming call screen, that way you can always pull up the photo on your phone and get out of an awkward situation or conversation with ease with the ?sorry, I have to take this? bit."
matthewsforprez,t3_919l35,284,6309,UnethicalLifeProTips,"ULPT: Going somewhere with your kids that doesn't allow outside food. Fuck 'em and pack sandwiches and chips anyway. When questioned at the entrance, just say these items (bread, chs, meat, etc.) are approved for your child's ""restricted diet"""
jayesch,t3_85v6ba,331,6303,UnethicalLifeProTips,ULPT: Want to stream/download movies but don?t want to deal with ad-ware? On google search for - ?MovieName? -inurl:(htm|html|php|pls|txt) intitle:index.of ?last modified? (mp4|wma|aac|avi). For e.g. Interstellar -inurl:(htm|html|php|pls|txt) intitle:index.of ?last modified? (mp4|wma|aac|avi)
brian8bigmacs,t3_bimwxv,109,6296,UnethicalLifeProTips,ULPT: Make a face when taking a picture of someone/something. People will assume you're taking a selfie and won't question it.
Boozlebob,t3_7n73wb,74,6288,UnethicalLifeProTips,"ULPT: To get through busy crowds try shaking a tin of coins and smiling at people, they will think you are collecting donations and avoid you at all costs."
zewski11,t3_7yvrsw,201,6282,UnethicalLifeProTips,ULPT: Set up a 900 number with a $10 per minute fee. Borrow people's phones to dial the number.
AntiCancerAvatar,t3_91fjab,440,6268,UnethicalLifeProTips,"ULPT: If you are going to carry a baseball bat in the back of your car for protection or crime, chuck a baseball and glove in as well then the police can?t charge you for possession of a deadly weapon. Just say you?re ?Going to the park.?"
TrollinDaGalaxy,t3_as8s5s,307,6251,UnethicalLifeProTips,"ULPT: Buy an amber flashing strobe light and keep it in your car. If you're ever stuck in traffic in a construction zone just slap it on the roof of your car and act like you belong, passing everyone in the process."
assemblrr,t3_851lox,140,6237,UnethicalLifeProTips,"ULPT: You don't have to change clothes, just the people you encounter."
SaugenEinenSchwanz,t3_7lu8av,254,6209,UnethicalLifeProTips,ULPT: Have to sleep in the same bed/room with a family member during the holidays? Make a sexual advance toward them so you'll never sleep in the same room with relative again!
Pit_27,t3_8z8zfb,249,6189,UnethicalLifeProTips,ULPT: There?s a glitch at the Target website where you can stack 7 different 15% off coupons to get over half off
mynameishimynameis,t3_9u3bzz,261,6181,UnethicalLifeProTips,ULPT: got 6 people who want a booking at a restaurant but when you call they say they only book for 8+ and anything less is walk in only. Tell them you got 8 and when you show up on the night tell them two in your party cancelled. They'll still take your booking.
Robotjoey81,t3_7ve5cn,173,6183,UnethicalLifeProTips,ULPT: struggling to get that job you want? Submit a bunch of terrible resumes with different names to make yours look better.
mpolska,t3_8t8eo7,157,6169,UnethicalLifeProTips,"ULPT: Offer your seat while still sitting in it, then people are much more likely to not accept, and you both get to keep your seat and you are seen as a polite person."
GraphyteHippo,t3_68bvzo,33,6160,UnethicalLifeProTips,"ULPT: When eating at a restaurant always act like you're planning to dine and dash(obviously stare at doors and employees, etc.), so that your waiter will stay close to you, therefore giving better service, to prevent you from dashing."
omgitschriso,t3_719k2x,231,6150,UnethicalLifeProTips,"ULPT: Always keep a broken flatscreen tv, laptop and phone in your car. If you ever have a car accident you can claim them all on insurance."
CherryLax,t3_6idri3,50,6101,UnethicalLifeProTips,"ULPT Mow others lawns for extra cash but raise the riding mower deck to the highest level, it cuts less grass and allows you to mow twice as often. Praise customers for their overly fertile lawns."
NathanHollister,t3_avegmk,404,6076,UnethicalLifeProTips,ULPT: Free games. Go to gamestop and buy a used game. Play it and bring it back within 7 days for a no questions asked refund. Free games!
Sir_Liamus,t3_624am3,92,6052,UnethicalLifeProTips,"ULPT: Can't afford an STD screening? Donate blood at your local Red Cross, they will alert you if your blood is unusable and why within 8 weeks."
effinbitch,t3_7iho33,150,6038,UnethicalLifeProTips,"ULPT: When playing spin the bottle, sit next to the least attractive person so it's more likely the bottle ""points to you"""
hopefulwarrior,t3_9h4tx5,348,6026,UnethicalLifeProTips,ULPT: At a religious place and want to look generous? Put monopoly cash in the donation box.
obnoxiousbmbastard,t3_8mbemr,157,5979,UnethicalLifeProTips,"ULPT: If you?re on a free-seating airplane and you want to have your row to yourself, just pour water on your shirt where your armpits are and hold your arms up when people are choosing their seats."
WagnerianDoorbell,t3_758jxf,191,5968,UnethicalLifeProTips,"ULPT: If your pet is missing and you put up flyers in the neighbourhood, always say your pet needs special medication/food, but don't mention why. This reduces the likelihood of anyone stealing your pet."
bOyDiE21,t3_9zxyq4,241,5969,UnethicalLifeProTips,"ULPT - If you're pissed about people driving down your road/street too fast and putting your family and neighbours at risk, tie some flowers to a lampost or tree nearby your house."
ABrooksBrother,t3_6m8ncv,56,5966,UnethicalLifeProTips,"ULPT: Can't afford great seats? Buy cheap tickets and look on StubHub a few minutes before the event starts to see which tickets are for sale, people will not be in those seats and you can confidently sit in that location."
homie1kinobi,t3_8j85ur,100,5937,UnethicalLifeProTips,ULPT: Too cheap to buy a card for any occasion? Just snap a picture of the card and write the words on a homemade card! It seems much more personal and thoughtful if the card is homemade.
[deleted],t3_9s3yml,256,5891,UnethicalLifeProTips,ULPT: Always mention you?re recording the conversation when you?re in unlikely circumstances. This will let people choose their words carefully or avoid the whole confrontation to begin with.
hulianjamner,t3_6vd0er,49,5869,UnethicalLifeProTips,"ULPT: When receiving a call from someone that you don't want to talk to but must talk to, tell them at the beginning of the conversation that your phone is about to die. You are then free to hang up whenever you want without seeming rude."
combatcvic,t3_79wni4,281,5845,UnethicalLifeProTips,ULPT: Serve Costco Mac n Cheese in your own dish and present it as your own at your next work potluck. Has won me best side dish award for 3 years!
SlothMaestro69,t3_6wxse5,100,5819,UnethicalLifeProTips,"ULPT: if you ever need to spend a little extra money on amazon to qualify for free delivery, then preorder something and proceed to cancel it after the parcel has been dispatched."
ThunderHandsJr,t3_6up3tn,109,5806,UnethicalLifeProTips,"ULPT: Put a sock on the end of your baseball bat so if someone grabs it, they only grab the sock, leaving you free to strike them repeatedly and maliciously."
mnfloro,t3_76hilm,353,5791,UnethicalLifeProTips,ULPT: Never tell vendors for your wedding that you're hiring them for a wedding. Tell them it's an event or reunion. Big price difference.
eliasminderbinder,t3_8ir0ej,244,5762,UnethicalLifeProTips,ULPT if you put a sock on the end of a bat it makes it harder for someone to grab from you
hiphopesq,t3_77731t,257,5745,UnethicalLifeProTips,"ULPT: If a supervisor asks, ""are things going well at home?"" Your answer should always be ""no."""
atticuslodius,t3_7nn7e8,216,5706,UnethicalLifeProTips,ULPT: Bed Bath and Beyond takes items back up to a year. Purchase bed sheets and keep the packaging. Repackage them and take them back every 11 months and replace them because they felt ?scratchy?.
ButtersHound,t3_bcctkg,188,5695,UnethicalLifeProTips,"ULPT Escape personal debt by getting married and move to PA. In PA you can't garnish wages and property is held by tenancy in the entirety for married people. They might win in court but if the debt is only in your name they can't sell your property, foreclose on your house, or garnish your wages."
lux_painted,t3_7m3t0k,178,5666,UnethicalLifeProTips,"ULPT: Want new, expensive, items? Wait until right after Christmas as drug addicts and alcoholics immediately try to monetize their gifts at vastly reduced prices."
Everbanned,t3_7tnieq,81,5671,UnethicalLifeProTips,"ULPT: Want to show your boss what a great, trustworthy employee you are so you can get a raise? Just ""find"" some money and turn it in to lost and found! Once your manager hears about your honesty, have your friend come in to the store and ask if any money was found in order to get your cash back"
[deleted],t3_8s8es9,345,5662,UnethicalLifeProTips,"ULPT: If you work in a job where you have access to a ton of computers, put crypto mining software on all of them to earn passive income."
xCruze,t3_92s04w,153,5622,UnethicalLifeProTips,ULPT: Can't be bothered taking your dry laundry off the line? Leave it for a week so your roomate is forced to do it so they can do their own laundry
nsfw_accountbrowsing,t3_7itaav,146,5618,UnethicalLifeProTips,ULPT: Want to borrow something of someone without them noticing? Take a picture of it before you take it then put it back in the same place once you're done with it
[deleted],t3_bf0pkv,159,5613,UnethicalLifeProTips,"ULPT: Flying a budget airline? Want to carry extra items for free? Buy a used CPAP RESMED travel bag. Medical Devices are exempt from personal Item restrictions, Airlines recognize the bags since they are common and don't question to look inside them."
whats_a_potato,t3_7zxonc,388,5616,UnethicalLifeProTips,ULPT: Use demo computers at Best Buy to mine cryptocurrency
PokerPlate,t3_7c94tq,185,5589,UnethicalLifeProTips,"ULPT: Use the same email to get multiple trials, beta key sign ups, etc."
Gamester49,t3_8m4wn8,142,5597,UnethicalLifeProTips,ULPT: See a pretty girl while driving? Hit her car to get her number.
random_user00,t3_90p1m6,153,5538,UnethicalLifeProTips,"ULPT: If you are a person who wants world to improve, convince science-deniers to fund your hoax research. With that money, secretly donate it or conduct actual scientific researches. When the science-deniers ask for the research results, simply make one up that suits their conspiracy theories."
MaybeAMuggle,t3_7yto6e,226,5517,UnethicalLifeProTips,"ULPT: Pass all your debt to a consenting suicidal person, so when they die, all your debt is gone. Also works on old people."
Marik_Bathory,t3_6jwrca,103,5406,UnethicalLifeProTips,"ULPT: When buying something on craigslist, send a bunch of insultingly low offers from burner emails, then send a 'reasonable' offer from your real address. They'll usually accept it."
3sweatyballs,t3_7uw15z,142,5398,UnethicalLifeProTips,ULPT : Always keep an extra pair of pants and a shirt in your car. You never know when you could use a change of identity.
ChanSamdler,t3_6y1k89,128,5357,UnethicalLifeProTips,"ULPT: Secretly put a nicotine patch on a girl every time they suck your cock, she will become subliminally addicted to sucking you off."
ViperNerd,t3_6z1xwy,195,5347,UnethicalLifeProTips,"ULPT: Hotel room doesn't have a fridge to keep beer, etc. cold? Call the front desk and tell them you need one ""to keep your insulin refrigerated."""
GentleBitch,t3_8lz3m6,154,5329,UnethicalLifeProTips,"ULPT if you want to win an Internet argument, counter with facts that are slightly off. That way the other person can't correct you without advancing your argument."
THESALTEDPEANUT,t3_6ve0sz,33,5286,UnethicalLifeProTips,ULPT: if you're an undercover cop posing as a prostitute and the perp asks to take nude photos of you for cash do it. You'll make some extra money on the side and still make a bust.
raymond8505,t3_auanfv,189,5273,UnethicalLifeProTips,ULPT: use a client relationship management program if you have a web if lies to manage
jdizzle3192,t3_8d26mx,178,5225,UnethicalLifeProTips,ULPT: When you give a Dunkin Donuts employee your card in the drive through they almost always give you the coffee before your card clears. Take a sip as its declined. Free coffee.
DutchHarBro,t3_bcl1j9,190,5212,UnethicalLifeProTips,ULPT: Got fired from a job? Still want it on your resume? Use a person who died working there as a reference.
sportscience,t3_ba2lvi,140,5197,UnethicalLifeProTips,"ULPT: go door to door ""canvassing"" for the political candidate you are trying to keep out of office. Be unpleasant, condescending, and hostile. People will associate your negativity with that candidate."
freetheboner2018,t3_710jh1,126,5193,UnethicalLifeProTips,"ULPT: instead of copying text when you plagiarize an essay, copy from YouTube lectures or documentaries. Converting audio to text is much harder for universities to detect."
Tlr321,t3_an8c4d,116,5182,UnethicalLifeProTips,ULPT: Want free parking near your college campus? Find an older person who lives near campus and doesn?t drive &amp; befriend them.
starkco5,t3_8qofmw,228,5177,UnethicalLifeProTips,"ULPT: If you need to test yourself for STD and don't have the money, go to a sperm donation center and you will even get paid for it."
dandoyd,t3_98u723,190,5154,UnethicalLifeProTips,"ULPT: Your kids won?t eat their vegetables? Prepare something grosser, like bugs. Make them choose."
butteryflame,t3_7fa4og,107,5129,UnethicalLifeProTips,"ULPT: When lying never use the word ""honestly"" or try to persuade them to believe. Just believe the lie and live your life."
Shoeeater1,t3_8sa5zb,104,5113,UnethicalLifeProTips,ULPT: Want to reduce your food spending? Plan dinners with family members at their homes. They will think you want to spend time with them and will probably end up feeding you at their expense.
fjordmewsky,t3_81xvlr,163,5099,UnethicalLifeProTips,ULPT: You have a girlfriend but still missing your ex? Gift her your ex's perfume.
EmuExporter,t3_8bhe83,139,5097,UnethicalLifeProTips,"ULPT: Whenever you have to give an email online or at a place you?ll never use again, give the email of a person you have particular disdain for."
Rocket_hamster,t3_8nx9sr,109,5091,UnethicalLifeProTips,ULPT Have a hoarder in your family? Introduce them to crack and they will sell all their stuff to feed the addiction.
Sxilla,t3_74h8w5,525,5089,UnethicalLifeProTips,"ULPT if you are going on a cruise that won't let you bring alcohol, fill up an empty mouthwash bottle with it."
shogi_x,t3_a8a3ln,50,5052,UnethicalLifeProTips,"ULPT: Didn't get someone a Christmas present? Say it got stuck in the mail and hasn't arrived yet. If they ask what it is, tell them you don't want to ruin the surprise. Wait a few days and regift them a present you don't want."
ToothpasteTimebomb,t3_7o87jm,199,5056,UnethicalLifeProTips,ULPT: Car acting funny? Try to sell it and tell the buyer they are welcome to bring it to a mechanic to verify everything is working properly.
TheRealSuperNoodle,t3_7poup8,241,5048,UnethicalLifeProTips,"ULPT: Find free college text books by Google searching for the exact title of the book in quotes with the word ""pdf"" outside of the quotes."
Macluawn,t3_7exrt0,106,4992,UnethicalLifeProTips,"ULPT: If you're a child and want to lie to your parents, wear a beanie that covers your forehead to hide the vein on your forehead."
tsmith944,t3_7zq2qs,272,4974,UnethicalLifeProTips,"ULPT: Want to get backstage? Grab a garbage bag out of garbage bin, throw it over your shoulder, keep a straight face, and walk backstage."
roblox_lover69,t3_834a6d,252,4951,UnethicalLifeProTips,"ULPT: If you ever murder somebody and are suspected of the crime, flee to Switzerland. They are extremely anti death penalty and will only extradite if promised by the US that they won?t give the death penalty."
DaBoy2187,t3_a6dmn5,217,4899,UnethicalLifeProTips,"ULPT : set your state as Alaska and some random village as your area when buying a game online like on the Switch, 3DS, Steam, ect, you will not be taxed and makes real Alaskans pfd bigger for the year helping them pretty well"
growleroz,t3_6vzn8e,82,4885,UnethicalLifeProTips,"ULPT: Treat yourself on your birthday. Buy a cake from the supermaket. Grind a large quantity of sleeping pills, mix them with frosting and generously cover the cake. Share the cake with your work colleagues. Once they have all passed out, go do something you'd actually enjoy doing on your birthday."
evrybdygetshigh,t3_bbjgf0,387,4879,UnethicalLifeProTips,"ULPT: Sick of people bumming cigarettes off of you? Carry around an empty pack so you can show that you're ""fresh out"""
senorElMeowMeow,t3_amyylq,219,4870,UnethicalLifeProTips,"ULPT: in a pinch, rubber cement makes an excellent napalm. Napalm however, is a mediocre adhesive."
PerntDoast,t3_78dwll,64,4819,UnethicalLifeProTips,"ULPT: When receiving a gift you don't particularly care for, excitedly ask the giver where they found it. This makes you seem invested in the gift, while also letting you know where you may be able to return it."
LDC7,t3_7qz535,94,4734,UnethicalLifeProTips,"ULPT: Want to make it rain at the club but you?re balling on a budget? Convert one US dollar to 22,376 Vietnamese dong. Now you can throw your dong around the club with no worries!"
Andmanley,t3_87lslz,182,4674,UnethicalLifeProTips,ULPT: Have a check engine light? Engine rattling but can't figure it out? Have someone else pay for the mechanic.
TheSweetestScrotum,t3_94qchd,144,4660,UnethicalLifeProTips,"ULPT: When asked about why you want the job, include the need to ""take care of a sick relative"". It puts you in a better light as well as gives off hints of loyalty and hard work ethic."
[deleted],t3_73mlaq,120,4647,UnethicalLifeProTips,ULPT: Got a scratch on your Nintendo Switch screen? Scratch it some more using the dock and send it in to Nintendo. If you blame it on the dock they will repair it for free.
Tibbs78,t3_7bczvx,71,4612,UnethicalLifeProTips,"ULPT: If you?re losing weight, make sure you always have lots of fattening food around you don?t like. If your friends &amp; colleagues are getting fatter, you get thinner twice as fast"
Drivebyw85,t3_6des1x,99,4589,UnethicalLifeProTips,"ULPT: Buy a ""baby on board"" sign regardless of your parenthood status, if you happen to be in a nasty crash paramedics and firemen will save you first."
significantsignature,t3_85oaem,74,4595,UnethicalLifeProTips,"ULPT: When you know where you are going to college, make sure to keep your other applications active. People often end up on waitlists and keeping your applications out can deny them a spot at a top university, thus weakening future competition in the job market."
firesofpompeii,t3_8084r9,100,4513,UnethicalLifeProTips,ULPT: Ensure your kids won?t bother you by telling them to wake you up in an hour so we can start cleaning the house - they will do anything to avoid waking you
Chrisfch,t3_72jj4t,114,4483,UnethicalLifeProTips,ULPT: Act like you're a bad liar when you lie about little things. This will make people assume you're a bad liar and you can get away with lying about bigger things more easily.
KeroseneMidget,t3_8mv7p0,70,4447,UnethicalLifeProTips,ULPT: Have a few demonstrably false rumors spread about you (X lost his hand in a traffic accident; X is in prison for armed robbery). People will eventually start to disbelieve even true rumors about you.
Juicydicken,t3_7glcgr,156,4424,UnethicalLifeProTips,ULPT: Are you a manager that hires people? Hire introverts that will do the job well. They will never be after your job.
lulzcakes,t3_7vcede,97,4418,UnethicalLifeProTips,"ULPT: If you?re a new alcoholic or in the process of becoming an alcholic, donate a kidney and part of your liver now so, when your remaining kidney or liver fails, you?ll already be at the top of the transplant list."
Nicolas0_,t3_81pqcy,139,4325,UnethicalLifeProTips,"ULPT: hire only OCD suffering people for street cleaning your city, this way it will always be clean."
thewirereal,t3_a5971n,82,4302,UnethicalLifeProTips,"ULPT: Instead of going to medical school, watch a few anti-vax documentaries, then set yourself up as a ""flexible"" doctor. Anti-vaxxers will flock to you where you can charge them extra for lecturing them about essential oils and natural remedies."
[deleted],t3_9enkx0,171,4306,UnethicalLifeProTips,"ULPT: If you have two dogs of the same breed and color, you only have to get pet insurance for one!"
plazenby740t,t3_8byv3k,98,4284,UnethicalLifeProTips,ULPT: Sneak into pretty much anywhere by carrying a large and awkward package over your shoulder. People will literally open the doors for you.
