author,name,num_comments,score,subreddit,title
abeannis,t3_9rayzi,480,53798,UnethicalLifeProTips,"ULPT: Save business cards of people you don't like. If you ever hit a parked car accidentally, just write ""sorry"" on the back and leave it on the windshield."
gingerbhoy,t3_a84ntk,513,43754,UnethicalLifeProTips,ULPT: Give your kids a bag of coal each for Christmas this year. When they cry just tell them Santa is wrong and you'll get it sorted. Once the shops open buy what they asked for. They will think you are a legend and Santa is a dick. You will also get the presents for half price.
reddituser123988,t3_9yioec,669,42472,UnethicalLifeProTips,"ULPT If you ever get caught sleeping at your desk at work then say ""They told me at the Blood Bank that this would happen"" when asked for a reason"
Tjetom,t3_a6z0eq,642,40493,UnethicalLifeProTips,"ULPT: If a computer illiterate relative/friend asks you to fix their slow computer, boost their cursor speed by a notch or two. They?ll instantly notice a difference and thank you!"
Sylocule,t3_99vv9n,502,39219,UnethicalLifeProTips,"ULPT: If you glue a dead wasp to the palm of your hand, you can hit your boss on the back of the head as hard as you like and act like you saved him."
existentialzebra,t3_9yyowl,733,38948,UnethicalLifeProTips,"ULPT As a parent of a baby, smell their diaper. If you DON?T smell poop, say, ?Woah, somebody has a poopy diaper. ? Then take them to the other room and pretend to change them. Then the next time they poop tell your spouse, ?It?s your turn. I changed them last time.?"
growleroz,t3_9aoxrm,727,36600,UnethicalLifeProTips,ULPT: Concerned about unvaccinated children spreading infection? Start rumours amongst antivaxxers that exposure to vaccinated children can cause their unvaccinated children to develop autism....the antivaxxers will be sure to keep their children at a safe distance.
[deleted],t3_a5i0b1,625,35852,UnethicalLifeProTips,"ULPT: If you decide to adopt kids, tell them that if anyone makes fun of them for being adopted, they should say ""At least I was wanted. You were probably a mistake and your parents didn't have the heart to tell you.""."
greree,t3_ajdphs,418,35685,UnethicalLifeProTips,"ULPT: Want your commercial to be seen by millions of people for free? Put it on YouTube with the title ""The commercial the Superbowl refused to run."""
TrueHuckleberry,t3_a915sd,716,34953,UnethicalLifeProTips,"ULPT: Buy the cheapest tickets available for a sporting event. Once inside, check Ticketmaster and Stubhub for better seats that didn?t sell and go sit there."
Coccyx_Avenger,t3_a97sp7,648,33821,UnethicalLifeProTips,"ULPT: Donate to homeless shelters in the next town over. The majority of homeless people tend to go where there are available services, and this will reduce the number of homeless in your town."
mahniij,t3_b01zep,624,33193,UnethicalLifeProTips,ULPT: In your last year of college ?lose? your student ID and get a new one. The exp date will reset and you can get another 4 years of discounts
gottalovefacts,t3_9r04wl,1165,33152,UnethicalLifeProTips,"ULPT: make your edibles in the shape of dog treats and take them anywhere you want. If a drug dog finds them, his handler will just think he's being a silly boy."
LeviathanGray,t3_aaiw3b,531,32565,UnethicalLifeProTips,"ULPT: If you ever rob a bank, make sure to hold your middle finger in front of you the whole time so the news has to blur your face in the security footage."
NUTS_STUCK_TO_LEG,t3_9paeso,1214,31185,UnethicalLifeProTips,"ULPT: Paper due at 11:59? Nowhere close to being done? Submit a paper you've done for another class and then use the time between then and when your professor emails you saying, ""Oops! Looks like you submitted the wrong paper"" to work on your actual paper"
A-ladder-named-chaos,t3_aaward,876,31141,UnethicalLifeProTips,"ULPT Whenever buying something online, try using the coupon code ""military"". Many sites have a military discount and don't require any proof of military service. I have seen up to 30% off with this coupon code."
snoof123,t3_a7vumj,697,30943,UnethicalLifeProTips,ULPT: Learn how to read braille and create a cheat/answer sheet for a test and put it in your hoodie pocket. You can feel the answers with your fingers without looking away from your test.
sashaatx,t3_a9z0d5,862,30357,UnethicalLifeProTips,"ULPT: Remember all those sketchy websites on Google, that let you watch any movie or TV show you wanted for free? They're all on duckduckgo.com now"
actually_crazy_irl,t3_9b9t5n,530,29449,UnethicalLifeProTips,"ULPT: Need friends? Create an attractive fake tinder profile of the opposite sex, start leading on a bunch of people, arrange a date with all of them on the same time, same place. Show up as well. Announce that they must have pulled a prank on all of you and suggest you all go drinking together."
krtle,t3_ay76p3,609,28392,UnethicalLifeProTips,"ULPT: Need a discount for an online purchase? Try variations of ""sorry"", ""sorry15"", ""sorry20"", etc. Companies will often have unadvertised coupon codes available to give to customers for faulty products or shipping mistakes."
Zuke020,t3_99n2pw,329,27681,UnethicalLifeProTips,"ULPT: Tell your friends that you've made them a partial life insurance beneficiary. They'll feel obligated to do the same for you, and will only find out you lied if you die first."
OmarFromtheWire2,t3_af6x6r,344,27326,UnethicalLifeProTips,"ULPT: If someone calls you fat, just tell them you used to be 75 lbs heavier. They end up looking like an asshole and you end up looking accomplished."
mrmojofilter,t3_a2nzsb,650,27104,UnethicalLifeProTips,"ULPT: Starting a new job? No matter what the reality is you now have four, alive grandparents"
bluejellybeans0711,t3_9lf84q,545,27080,UnethicalLifeProTips,ULPT: If you work in retail make a fake e-mail and write an e-mail to your boss/store praising yourself
mannyosu,t3_9hbxpw,589,27088,UnethicalLifeProTips,ULPT: Don't get caught by your boss reading news or sports articles on your computer at work. Quickly copy the content of the article into an email and read it from there. Your boss will think you are dealing with an intensive email and will leave you alone.
Sockemslol2,t3_9m89rv,316,26713,UnethicalLifeProTips,ULPT: Have a racist Grandmother? Photoshop a picture of your sibling with a black man or woman and tell her they?re engaged. She will take them out of the will and you?ll get a bigger share of the loot.
Royal-Derpness,t3_ahi3p1,421,26668,UnethicalLifeProTips,"ULPT: Everytime you eat at a restaurant, vote it ?unfriendly for kids? on Google Reviews, so you are less likely to have to deal with annoying little kids should you eat there again."
ihatemichaelbay,t3_a561le,913,25976,UnethicalLifeProTips,"ULPT: Stop shaming anti-vaxxers. Humanity needs to reduce its population, and its better for everyone if the stupid people volunteer to thin their herds first."
puzzydestr0yer69,t3_9fjtu4,278,25817,UnethicalLifeProTips,"ULPT: Your food business is not getting enough customers? Make a fake hot tinder profile and tell your dates to meet at your restaurant, pretend to be late and tell them to order something expensive for you. Then after you serve them call off the date because your BF/GF found out or something."
mcgonagallstwin,t3_9f3u7s,584,25679,UnethicalLifeProTips,"ULPT: If your coworker calls out of work sick, you can do the same 1-3 days later. Your boss will think you have the same thing and it's ""going around the office."" In fact, most of the time, your boss will do the same thing shortly after you. It's the fake flu."
brockm92,t3_ae5zep,917,25347,UnethicalLifeProTips,"ULPT: If you're going to cheat on your wife, do it with a married woman. Guaranteed mutual destruction is your safest bet."
El_Duderino1980,t3_9xea4n,500,25324,UnethicalLifeProTips,ULPT: Give the same perfume to your wife and your girlfriend. It could save your ass one day.
tarandfeathers,t3_a4kqvb,591,25170,UnethicalLifeProTips,"ULPT: Clean your house perfectly before the first working day of your new housekeeper. When she comes, apologize for the huge mess."
InJpnHrtSrgn1StdyHnd,t3_9d5cbi,932,25076,UnethicalLifeProTips,ULPT: Don't want to spend a small fortune on a wedding ring? Buy an old wedding ring at a pawn shop and say that it was your grandmothers ring. This will give it more sentiment and value than a new ring.
_blondefox,t3_a41d1g,1486,24990,UnethicalLifeProTips,"ULPT: If you see someone shoplifting from superstores this holiday season, just mind your own damn business. Those places don?t pay you to prevent their product loss."
depthandbloom,t3_9gccab,569,24910,UnethicalLifeProTips,"ULPT: Send a wedding invite to every billionaire you can find an address for, as there's a good chance their assistants just send you a gift without ever confirming who you are or if their boss knows you."
skydiverbrent,t3_b9c3qh,654,24890,UnethicalLifeProTips,"ULPT: If you?re driving next to a cop with drugs in your car and are trying to act normal, pick your nose. Your body language shows you aren?t concerned with anyone around you. The last thing you?d ever do if you were paranoid about a cop next to you is pick you nose."
skinjelly,t3_ayjubq,523,24678,UnethicalLifeProTips,ULPT Want to stop spam calls from a scam company? Go to the companies website an enter in your local congressman's office contact info and phone number. Your congressman's office line will get bombarded with spam calls and will hopefully take action against the company.
socialist111,t3_abeced,503,24466,UnethicalLifeProTips,"ULPT: Give fake money to homeless people. They will thank you for it, but also when they get arrested and taken to jail, it?ll reduce the number of homeless people in your area."
The-Real-Mario,t3_a4xkfk,828,24283,UnethicalLifeProTips,"ULPT: if you own a business near a Walmart and they compete against you : bombard every walmart employee with unionisation propaganda, the Walmart will layoff everyone and ""close for renovations"" and you also get a lot of resumes from seasoned retail workers"
ChaoticFather,t3_9vbnsi,471,24243,UnethicalLifeProTips,"ULPT: If a meeting is getting too boring, stand up and walk out *quickly* while staring at your phone. Nobody will stop you, and you'll have time to think of a decent excuse before you're interrogated."
Daanoking,t3_9m41s2,500,24082,UnethicalLifeProTips,ULPT : If your family or roommates dont want to upgrade internet speed just go into the router admin settings and set their devices to one of the lowest bandwiths possible. When they start complaining about it just tell them that upgrading internet will fix the problem.
Aoozzz,t3_ap8wxb,246,23722,UnethicalLifeProTips,"ULPT: If you can't get your roommate to clean up, create a fake Tinder profile, match with them and tell them you're coming over. They'll leave the place absolutely spotless in no time."
AudaxProtinus,t3_ahxqzk,421,23587,UnethicalLifeProTips,"ULPT: Starting at a new job? Make sure not to give 100% on your first day. Always give 75%. That way, if you play it down at 50% they'll think you're just having a bad day, and if you later start giving 100% you'll be more likely to get a raise for your improved work effort."
cannabisqueenkitty,t3_97drve,744,23178,UnethicalLifeProTips,ULPT: Drug tests at work? Bring homemade food for the office with slight amounts of thc. They can?t fire everyone :)
almostbobsaget,t3_9wow7c,948,22863,UnethicalLifeProTips,"ULPT: Looking for a gently used video game console/game/tablet this holiday season? Wait outside a GameStop, find someone trading in what you want and tell them you will give them $25 more than whatever GameStop offers them."
wutzabut4,t3_a3arem,240,22807,UnethicalLifeProTips,"ULPT, SLPT, ILPT, or LPT? A handy flowchart."
RoguishPrince,t3_9y5x4o,398,22645,UnethicalLifeProTips,ULPT: If you live with family or spouse now is the best time of year to order questionable things online (sex toys) and just say they can't see it because it's a Christmas present.
MiniJose,t3_97srua,456,22612,UnethicalLifeProTips,ULPT: College students! Looking for a rich SO? Go to your schools Top Parental Donors page and locate then seduce their kids.
changleosingha,t3_96o5zv,279,22604,UnethicalLifeProTips,"ULPT: If you hear a mosquito buzzing around at night while you are trying to sleep, cover yourself fully and uncover some skin of your sleeping life partner. You should be safer."
CoCGamer,t3_9hkdqx,443,22360,UnethicalLifeProTips,ULPT: Wanna browse Reddit at work or school without being noticed? This website makes Reddit look like a Microsoft Email account.
rayjensen,t3_9zsky2,1245,22320,UnethicalLifeProTips,"ULPT; if you?re a cashier at any big grocery store, whenever a customer doesn?t have a rewards card swipe, your personal card. As a cashier you?ll get a shit ton of rewards points."
jakk86,t3_a5q17c,817,22153,UnethicalLifeProTips,ULPT: Want telemarketers to stop calling you? Sexually harass them.
FantasyMaster85,t3_b53bv3,509,21778,UnethicalLifeProTips,"ULPT: If you want people to stop letting their dogs sh*t on your lawn, don't put up a ""no dogs allowed"" sign or a ""please pick up your sh*t"" sign...put up a ""Lawn Recently Treated with Toxic Pesticides"" sign - nobody wants their doggo or pupper walking around on/accidentally ingesting poison."
smallchimpu,t3_atx6z1,355,21516,UnethicalLifeProTips,ULPT:when going for interview make your 2 or 3 friends to sign up for interview as well and tell them to give the stupidest interview ever.
b_random9,t3_98krms,438,21505,UnethicalLifeProTips,ULPT: Tired of people driving badly in your area? Grab a random picture of a child off the internet and place it down with some flowers by the side of the road.
Anyonegotacookie,t3_9xyark,370,21481,UnethicalLifeProTips,"ULPT: If your mail service loses your mail a lot, keep sending letters to yourself but insure them. It costs about $10 to insure for $300 so as long as the courier service loses your mail more than 1 times out of 30, you're making money."
Macluawn,t3_9jljl5,724,21432,UnethicalLifeProTips,ULPT: Want your kids to become good liars? Overreact about every little thing they do growing up.
MasterDealer,t3_b25enh,643,21337,UnethicalLifeProTips,ULPT: Need a phone and/or cash? Volunteer to clean up after a big concert. People tend to lose their stuff there.
Deuseph,t3_a4arwk,558,21330,UnethicalLifeProTips,"ULPT: If your child is diagnosed with autism or cancer, save hundreds of thousands of dollars by instantly putting them up for adoption."
SarcasticCroissant,t3_9mnx9f,672,21174,UnethicalLifeProTips,"ULPT: Take a picture of your luggage with as much cash as possible so if an airline loses it you could get extra money, as you have photo evidence of money being in the luggage"
tylerdurden1993,t3_a5uxi3,340,21173,UnethicalLifeProTips,ULPT: Need to trespass? Bring a dog leash. If anyone asks why you are on their property you can tell them you are just looking for your good boi.
AvianLawman,t3_b5qmwz,500,21056,UnethicalLifeProTips,"ULPT: If you work in an office where your coworkers can?t see you enter, dont say good morning to them as soon as you walk in. This way when you are late they won?t know and will just think you haven?t come to say good morning yet."
Life_God_Lemonade,t3_aezu9d,368,21034,UnethicalLifeProTips,ULPT: Buy expensive items and place them around your house. Take a video camera and spend 10min filming every room and every item in your house. Return the items to the store. If you are ever in the unfortunate situation of a house-fire this will make insurance fraud a thousand times easier.
newthingsforus,t3_b9wssk,408,20700,UnethicalLifeProTips,ULPT: Selling a vehicle? Stop into a very nice neighborhood to take pictures. Buyers will be more interested to buy a vehicle from classy people who have money to keep it maintained.
Western_You,t3_9vx1n9,420,20627,UnethicalLifeProTips,"ULPT: Lie as badly as you can. For example, act like its hard to make eye contact/keep a straight face/not laugh. Then, when you actually need to cover something up, its much easier for someone to believe your lies because you're an ""awful liar"""
Neckbeard_Police,t3_9tizil,1683,20542,UnethicalLifeProTips,"ULPT: Just lie about having a college degree. Companies rarely check, and the only consequence if they do is not getting hired."
pinkgandhi,t3_agymjw,637,20452,UnethicalLifeProTips,"ULPT: Having an affair? Change your lover's contact name in your phone to ""Scam Likely,"" so your primary partner won't question why you're getting so many calls."
Onywan,t3_atjdho,573,20409,UnethicalLifeProTips,"ULPT: If you want to call in sick and need a certificate from the doctor, you can often triple the duration of your certificate by telling the doctor that you're working in the food industry."
NerfThis_49,t3_aclntl,483,20409,UnethicalLifeProTips,"ULPT: if you need to lie about something, include an embarrassing unnecessary detail. After all, why would you intentionally lie to make yourself look bad?"
TheStorkClipper,t3_9ketk2,292,20360,UnethicalLifeProTips,"ULPT: Don't feel like doing the dishes? Grab clean plates, make them wet, put them in the drying rack and tell your roommate to do the ""other half"" of the dishes."
pac_man2321,t3_9uvgse,491,20288,UnethicalLifeProTips,ULPT: You can copy off Wikipedia if you translate the Spanish version of the page. Grammarly?s plagiarism checker gave it an all clear.
The2500,t3_at7bag,612,20229,UnethicalLifeProTips,ULPT: Win internet arguments by editing your comments after your opponent has responded to completely change what you said and making it look like your opponent has no idea what they're talking about.
BlackCoke2,t3_agmvfj,744,20211,UnethicalLifeProTips,"ULPT: College students, if the coffee places on your campus have a punch card reward system (buy 10 cups, get one free), look online for the same hole-puncher design they use. Unlimited coffee for 4 years for about $10"
manuealesc,t3_ad2cjk,723,19483,UnethicalLifeProTips,"ULPT: If you own a drone, now is the best time to fly over that national park you've always wanted to but never been allowed to."
jvhero,t3_9op8gp,428,19309,UnethicalLifeProTips,"ULPT: To get someone off Facebook all you need is the email address they use to log in. Several times a day attempt to log in to their account. It will then tell them their account isn't secure and require a password change. Eventually, they will get frustrated and stop using it."
HronkChaos,t3_9hzbjq,613,19279,UnethicalLifeProTips,ULPT: Create a false Tinder account with a very handsome person. Don't swipe to anyone for a week and wait to get a bunch of likes. Then change all your profile and start to swipe.
Captain_Ahbvious,t3_9dnm6x,444,19199,UnethicalLifeProTips,ULPT: buying something second-hand off of apps like OfferUp? Create multiple accounts to use one where you will offer the amount you wish to purchase at and all the others to lowball the shit out of the seller to make them think that yours is the best offer.
ekvin0,t3_a9pl64,337,19048,UnethicalLifeProTips,ULPT: invite your annoying friends when you know they can't go. It's a great excuse when they complain about never getting invited to stuff.
Skydiever,t3_9s60kq,476,19024,UnethicalLifeProTips,"ULPT: At a gas station don't ask someone for a couple bucks, ask for a couple gallons. Everyone asks for money and usually don't believe you thinking will use it for beer. Putting gas directly in the car they know that's where it's going to. A couple gallons is worth much more than they would give."
Rainmert,t3_aqn9bk,663,18924,UnethicalLifeProTips,"ULPT: If you ever find yourself in a situation in which you need to create a fake online profile, you can use this site to get an A.I. generated face of a non-existing person:"
DBTheNerd,t3_a25d2g,211,18857,UnethicalLifeProTips,"ULPT if you miss a sale by an hour on a website, use a vpn to get into a different time zone and some websites will still have the sale"
sotheg8r,t3_aa8io4,277,18824,UnethicalLifeProTips,ULPT: Need a stock photo without the watermark? Do a reverse image search and scroll through to find it on an article. Media companies usually buy the image and upload it on articles
itherm,t3_akzzgi,1015,18733,UnethicalLifeProTips,ULPT: Buy a domain name from google domains and set up ?catch-all? for emails. You now have unlimited email addresses for unlimited free trials. BONUS: Get a credit card that gives you a virtual number (Citi or BofA) for free trials that want a credit card. Now you also have unlimited credit cards!
homebuyer99,t3_b3f0d1,818,18664,UnethicalLifeProTips,"ULPT: If you're ever doing business with a Chinese company that tries to fuck you over, email them back ""June 4 Tiananmen Square Massacre"" in Chinese ( ????????) and BOOM! the CCP will cut their Internet."
PoppaPickle,t3_9vjtla,469,18511,UnethicalLifeProTips,"ULPT: If you are faking injury make sure you fully commit to the role, be hurt and struggle with simple tasks even when there's no doubt that you aren't being watched. It will help you sell it when people are around and security cameras/wondering eyes can make or break your case."
YoungSalt,t3_9odqtl,485,18468,UnethicalLifeProTips,ULPT: Create a frozen seafood company called Fresh Off the Boat so that restaurants which buy from you can claim their seafood is fresh off the boat. You charge a premium over other frozen food suppliers but they pay less than buying fresh.
Mango_Punch,t3_ag8u9j,534,18382,UnethicalLifeProTips,"ULPT/ILPT: If you want to gift someone a large amount of money, instead have them sue you for personal injury and settle out of court"
mozgarob,t3_9ew8yw,404,18330,UnethicalLifeProTips,"ULPT : If you are tired at work, just lie down on the floor at random places and sleep. When your coworkers wake you up, they are gonna be really kind and helpful because they think you have fainted. If you play it really well, you can get the rest of the day too."
Disastrous_Plankton,t3_awcy5n,428,18322,UnethicalLifeProTips,"ULPT:If your girlfriend has a friend who always annoys you, just go to your girlfriend and casually mention how pretty that friend is. Chances are that it will be the last time you'll ever see or hear about that annoying friend."
Lightningbolt724,t3_acwd14,425,18021,UnethicalLifeProTips,"ULPT: Own a bicycle shop? Scatter shards of glass near your shop. When people bike past, their tire might get punctured and since your shop is close, you get more business than other bike shops nearby."
SouthDistribution,t3_9tvcnv,336,17901,UnethicalLifeProTips,ULPT: Want to smoke some free pot but dont have any friends? Search craigslist for houses that need roommates that are '420 friendly'. Show up to 'view' the place and eventually comment on their pipes/bongs. They will probably smoke you up to make sure you are 'cool enough'. Then leave.
shookron,t3_9udg2o,453,17763,UnethicalLifeProTips,"ULPT: Leave Glassdoor reviews stating company policies you want changed, when co-workers quit or get fired."
windirfull,t3_b6mbcj,587,17581,UnethicalLifeProTips,"ULPT: If you're broke, move to a small town and start a locksmith business. Since many people in small towns don't lock their car doors, you can go sneakily go around locking people's cars and simply wait for the service calls and subsequent cash to start rolling in."
Andraste_Of_Reddit,t3_9923dl,885,17363,UnethicalLifeProTips,ULPT: Unsure if the prostitute you want is an undercover cop? Ask her to nude model first. It is not illegal and an undercover cop will not do it however the prostitute will.
Absoludacris1,t3_9rsgyv,401,17277,UnethicalLifeProTips,ULPT: Accuse your significant other of something you know they didn't do and study their reaction. Now you know how they'll act when telling the truth on the future.
-jsm-,t3_asu09p,546,17269,UnethicalLifeProTips,"ULPT: If you?re missing an arm or a leg and want a military discount, just ask for it regardless if you served; they probably won?t ID you."
OneBigBrownDog,t3_a9fekl,145,17188,UnethicalLifeProTips,ULPT: If you hold up your phone at the right angle during present unwrapping you can browse reddit while making it look like your taking family photos.
VerbableNouns,t3_9sxylk,332,17027,UnethicalLifeProTips,ULPT: Become a mod so you can censor those you disagree with.
kozk95,t3_9j3qum,329,17004,UnethicalLifeProTips,"ULPT: If your girl is talking too much, hug her and tell her you wish to listen to her heartbeat. Not only will she stay quiet, you?ll score points in the romance field."
ganonboar,t3_85av9i,325,16965,UnethicalLifeProTips,"ULPT: See a girl you like on a dating app? Before you message her, send her loads of unsolicited dick pics with fake accounts. Then, when you message her, she'll be happy she finally found a 'gentleman.'"
Flojoe420,t3_anexni,930,16935,UnethicalLifeProTips,ULPT Want a quick way to get rid of Jehovah's Witnesses? Ask them if they're here for the orgy.
Nerdaxic,t3_9pu4jy,278,16814,UnethicalLifeProTips,"ULPT: If you get a parking fine as you didn't have a valid parking ticket (coupon) visible in the car window, just wait around for someone else to leave the parking lot, ask for their ticket - which was probably valid when you got the fine. Send a picture to the parking authority to dodge a bullet."
cbildfell,t3_abm4z8,474,16807,UnethicalLifeProTips,"ULPT: Use the ""send at a specific time"" feature on most email platforms to make it look like you're working at all hours of the day when emailing/cc'ing your boss"
ehwhatsup77,t3_9e8zwk,455,16624,UnethicalLifeProTips,"ULPT: Bring a dead cockroach with you everytime you stay at a hotel. Throw it on the ground somewhere in your room, then call reception saying you ""found"" a dead cockroach. You'll probably get a free room upgrade or a discount for the rest of your stay."
