author,name,num_comments,score,subreddit,title
Mr_Siphon,t3_6jh0l2,33,2014,UnethicalLifeProTips,"ULPT:If you're planing on shoplifting, make sure to steal a fire extinguisher too. People aren't going to stop you if you're running with one"
RabidCycler,t3_8qb89k,35,1989,UnethicalLifeProTips,"ULPT: If you find a stray dog or cat and are able to capture it don't post found animal signs immediately. Instead, wait a day or two and see if the owner will post reward signs in the neighborhood first."
TheEpicGreenMask,t3_6r50ma,94,1995,UnethicalLifeProTips,"ULPT: If you live in the US and are ever forced to join the Army, come out as Transgender, even if you aren't actually. They will refuse you."
kc9kvu,t3_77uvft,21,1971,UnethicalLifeProTips,ULPT: Post bad advice for job seekers on reddit to narrow down your competition
CarthageInRuins,t3_6cgyvu,81,1950,UnethicalLifeProTips,ULPT: If you want to get laid easily and enthusiastically
Sauflieder,t3_92j3td,157,1930,UnethicalLifeProTips,"ULPT: Rather than making clients pay up-front for sex (prostitution), simply have your clients pay you per a non-disclosure contract in which you both agree not to reveal your sexual encounter."
Milan4King,t3_71zrjx,46,1918,UnethicalLifeProTips,ULPT: Borrow money from others and keep it for a day. Then give their money back to build trust.
blackgold16,t3_9pzs47,70,1911,UnethicalLifeProTips,ULPT: Email all the candidates in local races saying you?re excited to vote for them. They?ll reply with generic ?Thanks.? Then if you have any issues with city council etc just reply back to that email with your request for help and they?ll be much more likely to assist right away.
dj_boy-Wonder,t3_6q36p8,104,1890,UnethicalLifeProTips,"ULPT: are people in a house near you having a loud party? Don't just phone in a noise complaint, the police almost never respond to those, instead, tell them you can smell pot or hear arguing. They'll be over in no time"
pgliver,t3_6l6t06,88,1890,UnethicalLifeProTips,ULPT: Has one of you electronics stopped working? Go buy the exact same model from a store then return your faulty one in the box for a full refund.
Ethanzap02,t3_8h988d,76,1888,UnethicalLifeProTips,"ULPT: Always having annoying or tall people sitting in front of you at the movies? Make it a habit to pour water on the seat in front of you before anyone sits there. If anyone tries to sit there, they will sit down, stand back up, feel the seat, and leave."
HenryArthur21,t3_705ot2,148,1877,UnethicalLifeProTips,ULPT: wanna find out if your kids are doing drugs? Tell them you're going on a weekend away and come back that evening.
leafninjadog,t3_8vus0t,52,1852,UnethicalLifeProTips,"ULPT: If you accidentally say something offensive in a group, follow it up with a playful ?I hope somebody got that reference.? That way people won?t think as much of it."
gettheguillotine,t3_9zyolp,42,1841,UnethicalLifeProTips,"ULPT: Wanna beat kids? Become a religious leaders and parents will let you ""cast out the demons' from their children"
Arkham_Z,t3_89791p,31,1836,UnethicalLifeProTips,ULPT: Trying to end a phone call? Turn your mute button on and off while you're talking. This will mimic a bad connection and allow you to hang up.
oldrusty0_0,t3_9jymte,39,1834,UnethicalLifeProTips,ULPT: Need to apologize or confess something to a buddy? Do it in front of a girl he's trying to impress; he'll turn into the chillest guy ever.
YPG-Got-Raqqa,t3_715lnu,69,1820,UnethicalLifeProTips,ULPT: If you live in a very rural area order a Leesa mattress and then return it. If they can't find a Goodwill or Salvation Army near by they tell you to set it out with your trash and take a picture of it by the curb. Then you get your money refunded and keep the mattress.
OnlyEnemiesSpyOnYou,t3_8n7j3l,39,1806,UnethicalLifeProTips,"ULPT: Don't post your best ULPT here, if everyone knows about it you won't be able to get away with it anymore"
clarkyto,t3_7zxor9,105,1788,UnethicalLifeProTips,"ULPT: If you have a dog and need poo bags for cleaning up while walking, just walk in to any supermarket produce section and take a roll of bags, they cost about $0"
Shadow_BR,t3_6vicn7,77,1780,UnethicalLifeProTips,"ULPT: when planning on breaking up with someone, gradually retrieve your stuff from his/her home, so you don't lose something important on the breakup."
ASK_ME_FOR_TRIVIA,t3_9uzh02,64,1786,UnethicalLifeProTips,"ULPT: If you lie about something and ask someone to help cover your tracks, try to act extremely out of character the entire time you deal with them. If the other person spills the beans and quotes you on anything, you can cover yourself with, ""Does that really sound like something I would say?"""
RobTheRevelator,t3_8kuw1a,56,1771,UnethicalLifeProTips,ULPT: Tell one friend group that your birthday is on the correct date and another that it's on a different one. Enjoy your second birthday.
DankMemesBlake,t3_ad9ay7,125,1773,UnethicalLifeProTips,ULPT: Sick of getting served old fries at McDonalds? Say that you have hypertension and need to limit your sodium intake and you would like fries without salt. They'll have to make a new batch. Bonus points if you ask for salt packets after you get your nice and fresh fries.
8khays,t3_6fbbez,86,1754,UnethicalLifeProTips,"ULPT: If someone is tailgating you, hit your hazards for a brief moment"
BigRedCowboy,t3_bh131m,60,1756,UnethicalLifeProTips,"ULPT: Always bring something with you to work (water bottle, notebook, hat, etc) and make sure people see you leave with it. That way, if you feel like taking a long lunch or leaving early, just leave the thing sitting at your desk and people will assume you are around somewhere."
Shirkaday,t3_6t8i3u,46,1751,UnethicalLifeProTips,ULPT: Steal a traffic cone and carry it around in your trunk in case you need to save a really prime parking spot
UselessSage,t3_7s1l2q,118,1746,UnethicalLifeProTips,ULPT: Check your condo\apartment for outlets in your unit not connected to your meter.
danielmarkwright,t3_82eqng,32,1740,UnethicalLifeProTips,"ULPT: Struggling to write the perfect CV? Post an ad for the exact kind of job you're trying to get, take the three best ones, and use the best bits to create your own perfect CV."
carljohnson0722,t3_8hp3lt,106,1724,UnethicalLifeProTips,ULPT: Take a life insurance policy out on your heroin addicted family member. Odds are they'll die soon
AnastasiaSheppard,t3_83chuv,19,1716,UnethicalLifeProTips,ULPT: own a cafe in the city? Put up a big clock outside that's 10 minutes slow. People on their way to work will think they've got extra time to grab a coffee/breakfast.
atticuslodius,t3_87vcdx,80,1700,UnethicalLifeProTips,"ULPT: Instead of pot brownies, make edible pot dog biscuits. When the drug dogs sniff you out it will look like they are sniffing out the dog treats instead."
balloonsforhandsguy,t3_98prgq,154,1690,UnethicalLifeProTips,ULPT: Tired of annoying kids in video game voice chat? Just broadcast a high-pitched sound only young people can hear to scare them away.
MrMatix11,t3_85p0x4,79,1684,UnethicalLifeProTips,ULPT: Female working as a waitress? Wear a fake baby bump. Enjoy the increase in tips and less strenuous activity on the job.
Daddy---Issues,t3_7zv9ld,94,1683,UnethicalLifeProTips,ULPT: If you smoke weed in your parents house and worry that you haven't gotten rid of the stankyness completely put a bag of popcorn in the microwave until it lights on fire to mask the smell.
F0rkey,t3_6zo1cs,74,1679,UnethicalLifeProTips,"ULPT - If you're trying to get a free item from lost&amp;found, and are asked the color of the item, tell them that you are colorblind"
TimTheTinyTurtle,t3_8e6vyw,51,1675,UnethicalLifeProTips,"ULPT: Are you scared to go to the gym because you are weak? Just wear an ""I beat cancer"" shirt. This way others will sympathize and you won't be embarrassed of how weak you are."
still-improving,t3_74q5zk,72,1636,UnethicalLifeProTips,"ULPT: To all young teenagers looking for their first job, if your parents can get you a job, let them. Nepotism lands better jobs than qualifications or schooling."
StratuhG,t3_6rqtyr,38,1640,UnethicalLifeProTips,ULPT: Meeting someone at a parking lot to buy drugs? Sit in the passenger seat so it seems like you're waiting on someone inside the store.
ImpliedShrimpZ,t3_8idr8f,65,1625,UnethicalLifeProTips,"ULPT: If someone fakes you running over them for lawsuit money, tell them you have a dash cam, even if you don't. They'll usually bail before testing if it was true."
chanmaxi,t3_baaz8e,78,1623,UnethicalLifeProTips,"ULPT: If you need to withdraw more money than your limit, if you do it quickly enough, you can withdraw your limit twice from the same ATM and sometimes the one next to it before it stops you from withdrawing any more."
demonkobra,t3_7252jv,111,1621,UnethicalLifeProTips,ULPT: dont die alone. if you have an SO and you die first you dont need to make any plans they will take care of it
-JeffWong-,t3_8qt3pg,51,1623,UnethicalLifeProTips,ULPT: Someone cut you off in traffic? Write down their license plate and report it as the getaway car the next time you witness a robbery.
mickrortyyy,t3_6lgpi6,40,1609,UnethicalLifeProTips,"ULPT: If you need to shoot someone, do it on the 4th of July; gunshots will be mistaken as fireworks or at least an act of patriotism."
t184256,t3_6qtuwh,46,1612,UnethicalLifeProTips,"ULPT: If you don't want to give your seat up to an elderly person/woman on public transportation, but somehow feel obligated to, ask them while sitting instead of physically getting up. They are less likely to accept your offer if the seat in question is occupied. (inverse x-post r/LifeProTips)"
PsyJak,t3_6szhxf,13,1611,UnethicalLifeProTips,"ULPT: If you need money, ask friends/family for a loan. You'll likely be under very little pressure to pay it back, especially if they frequently browse r/LifeProTips."
TheHobbles,t3_8esf4a,72,1605,UnethicalLifeProTips,ULPT: If you?re trying to check out a hot chick but she?s with her boyfriend stare at the dude first and wait to make eye contact. He?ll look away awkwardly and you?re free to check out his woman.
Chinotwopointoh,t3_73hvs5,74,1592,UnethicalLifeProTips,"ULPT Cheap movie tickets: Buy a child's ticket online for the movie you wish to see, then use the automated ticket booth to print your ticket. Odds are no one will notice, and if they do, simply claim you accidently clicked the wrong thing online."
Kiwi_Cog,t3_7cj0xb,22,1600,UnethicalLifeProTips,"ULPT: If you want to do something unethical, but are afraid of getting caught, post it to /r/UnethicalLifeProTips . Commenters will then find your plan's flaws, allowing you to improve your strategy"
powyuhdig,t3_887lox,136,1591,UnethicalLifeProTips,ULPT: If a girl says you got her pregnant demand a paternity test and give them the DNA from one of your friends they have never met
RDizzle42,t3_8wult4,46,1562,UnethicalLifeProTips,"ULPT: If you contract a rare disease with no cure, infect a famous person with it. Awareness and funding for research for the disease will rise dramatically once it has a famous spokesperson"
uncensorednsfw,t3_8zpxs2,73,1553,UnethicalLifeProTips,ULPT: If someone blatantly lies to you play into it and ask for as many details as possible. You will make them go deeper and deeper into the lie and make their life hell.
GeneralOsik,t3_7n92tn,71,1554,UnethicalLifeProTips,"ULPT: Order you pizza square cut. Most pizza places will forget and cut it in pie slices. When you go to pick it up, complain that it isn't square cut, and ask for a coupon or voucher for a replacement. Take home your perfectly good pizza, and get a free one next time."
Healter-Skelter,t3_6zjdiy,48,1550,UnethicalLifeProTips,"ULPT: if you're a conman, stop using phrases like ""believe me."" People are starting to catch on"
tomj0rdan,t3_6thw83,26,1546,UnethicalLifeProTips,ULPT: Tired of your taxi driver driving slow to get the meter up? Make yourself look sick (cough and sneeze) and he will speed up to prevent catching something.
Sorrowwood,t3_87pgop,70,1539,UnethicalLifeProTips,"ULPT: If your city is very dirty just spray nazi logos everywhere. City management will pay to get those power washed ASAP, thus resulting in a cleaner living environment for all."
actually_crazy_irl,t3_7m1qj7,51,1540,UnethicalLifeProTips,"ULPT: if you're going to lie your age, go up instead of down. If you say you're 10 years younger than you are, people will think you look trashed. If you say you're 10 years older, people will be impressed by how great you look for your age"
the_space_ostrich,t3_8lz5nn,54,1533,UnethicalLifeProTips,ULPT: It's common practice for venues to serve drinks without caps or lids to make them harder to throw at the performers. Bring stoppers and/or tape to make that beer you lob at the bassist heavier and more accurate.
jaono,t3_7m24co,31,1530,UnethicalLifeProTips,"ULPT: Looking at committing a crime but unsure how to stay in the clear for it? Go to a neighbors house after Christmas and grab any used wrapping paper from the bin, it's almost guaranteed to have their fingerprints all over the tape for you to set them up with."
KallisteDia,t3_8oymu9,59,1530,UnethicalLifeProTips,"ULPT: Are you pregnant in the US and want the child? Go to a clinic that tries to persuade women not to have an abortion, they will give you lots of free baby stuff."
fortegod,t3_85p9c3,42,1528,UnethicalLifeProTips,"ULPT: Don't want to pay a subscription to read articles on websites like nytimes.com? Click an article on the site, then immediately press ""Ctrl+A"" then ""Ctrl+C"". If you do this before the pop-up appears to subscribe, you can paste in Microsoft Word for the full article."
StampAct,t3_79gfgm,45,1507,UnethicalLifeProTips,ULPT: Whenever you see a terrible car accident on the highway take a picture on your phone. Next time you are late you can claim you were caught in traffic and use the photo as proof.
daviswray1,t3_76h6xb,46,1504,UnethicalLifeProTips,"ULPT: Open a police radio scanner store. Post on Reddit stating you're a police dispatcher, tell everyone to buy one with a bunch of false 'inside information' on how to work it."
Fearthekoala4,t3_85uc1l,64,1505,UnethicalLifeProTips,"ULPT: If you are about to commit a crime, leave your phone on a train or bus so when your cell phone records are pulled, they will see you weren?t near the scene of the crime."
wile_e_chicken,t3_a94nqi,24,1493,UnethicalLifeProTips,ULPT: If you're at work or school this site will let you use Reddit and it looks like Outlook email.
just-4-me,t3_7hxgmj,70,1496,UnethicalLifeProTips,ULPT: used 'delay send' to seem like workaholic
throwitoutbutmaybeno,t3_7abgym,91,1494,UnethicalLifeProTips,"ULPT. want to get cheap electronics straight from the store? Most retailers will have a price match policy. Using google, chrome go on a website of a competing company and using the ?inspect element? tool you will be able to change the prices displayed on the webpage. Use this to get discounts."
Serenaded,t3_73wjho,29,1474,UnethicalLifeProTips,"ULPT: EARN big money by displaying a ""How's My Driving?"" sign on your car, along with an 0906 number (?1.50 per minute) which you can acquire through BT. Then simply drive around town like a complete arsehole."
ttayl107,t3_903hho,12,1463,UnethicalLifeProTips,ULPT: Prepare your kids for social media by putting their artwork on the fridge and writing a bunch of mean comments underneath.
Bigbastien,t3_a5dbt7,58,1443,UnethicalLifeProTips,"ULPT: In college and ran out of money for beer? Ask for Walmart gift cards. Relatives will think they are helping you with groceries, but you can now buy beer at Walmart."
Donkeydonkeydonk,t3_6ph8px,99,1442,UnethicalLifeProTips,ULPT: Use your phone to shut off televisions in public places.
Dariszaca,t3_79rtg0,96,1438,UnethicalLifeProTips,"ULPT : Girlfriend caught you looking at another girl ? Say something like ""You should get that dress/those shoes"""
harrydavise,t3_ad5lwk,40,1426,UnethicalLifeProTips,ULPT Go to your local thrift store/second hand store. Take pictures of the items and put them up on eBay or craigslist for more than the thrift store is charging. If someone wants it you make a profit and if the item is gone from the store say that they were too late and someone else bought it.
rickjsantos100,t3_8ekt1n,41,1421,UnethicalLifeProTips,"ULPT: The day you start dating someone, take her/him to dinner to a cheap restaurant, that way every dating aniversary you can go back there and say it's special saving a lot of money."
poi123e,t3_6vtm3y,69,1419,UnethicalLifeProTips,ULPT: Want to convince someone you're a hacker who can access their phone/location on sites like Omegle? Use Grabify.link!
AD29,t3_7o8oah,60,1419,UnethicalLifeProTips,"ULPT If you?re serving life in prison without parole, confess to committing crimes that other inmate are in prison for. They?ll get released and your sentence can?t get any worse,"
driticool,t3_70x5s2,56,1413,UnethicalLifeProTips,ULPT: Save money at festivals by digging near trees until you find someone's liquor stash.
Lifew0rk,t3_78ic12,37,1410,UnethicalLifeProTips,"ULPT: Drive a company vehicle? Put a ?How?s my driving? sticker on your vehicle, plus a phone number below it that you control, so that when you drive like a dick, other drivers call you instead of your employer."
dannythetwo,t3_7c6bhk,52,1388,UnethicalLifeProTips,"ULPT: Have a bunch of wrapped empty boxes under your Christmas tree. When a child misbehaves or doesn't listen, throw one in the fireplace"
adamdavenport,t3_6cbijs,26,1386,UnethicalLifeProTips,"ULPT: Put a box next to a public dumpster with a ""donations here"" sign. You'll get all sorts of free stuff."
pmurtittiesnkitties,t3_70xuzh,59,1379,UnethicalLifeProTips,ULPT: Buy an online mattress from Casper etc. Return it. It will get picked up by a local charity like Goodwill or Salvation Army and you can pick it up at their store for a fraction of the price.
PM_ME_ADVICEPLS,t3_7j0t6d,47,1380,UnethicalLifeProTips,"ULPT: Called in sick to work stating family problems? Put up a Facebook status saying ""Thanks for all the messages of support"" and edit who can see it to just your co-workers."
RedditSuxxCoxInHell,t3_7qd462,63,1371,UnethicalLifeProTips,"ULPT: If you want people to stop talking and pay very close attention to what you say, start your sentence with ""The thing about the &lt;ethnic group&gt; is..."""
Necrowizard,t3_8v1ztu,34,1357,UnethicalLifeProTips,"ULPT: Always carry some 'Designated Smoking Area' stickers with you. Whenever you want to smoke somewhere, tag the area with your stickers."
BurlapSakk,t3_6ixwom,16,1352,UnethicalLifeProTips,"ULPT: Take your own tags to flea markets and thrift stores. Find something you want and write down your own price, then just pay that. Flea markets don't know the prices that the booth renters set so it can be anything."
Beerman987654321,t3_8g5nmb,91,1339,UnethicalLifeProTips,"ULPT: If unsure of yourself at work, display some subtle homosexual tendencies. The company will be more inclined to promote people of diversity and more cautious when considering any disciplinary action due to your new minority affiliation."
I_Love_Dean_Spanos,t3_77ia9z,44,1336,UnethicalLifeProTips,"ULPT: Get your side hoe the same perfume as your girlfriend, that way you come home smelling like her."
donutbesosilly,t3_7fn5c4,36,1318,UnethicalLifeProTips,"ULPT: When starting a new job, make a big deal about your gluten-free vegan diet. This way if food happens to go missing from the fridge, no one will suspect you."
AutoDidact23,t3_6rmjr9,43,1312,UnethicalLifeProTips,"ULPT: Want to change seat on an airplane? Buy a bag of nuts, crush them on your seat and claim you have a nut allergy and the nut residue is affecting you."
The2500,t3_70xuvk,118,1306,UnethicalLifeProTips,"ULPT: If you're of legal age, make easy money by buying alcohol and selling it to minors at a high markup."
Readditor57,t3_6u4ho1,57,1310,UnethicalLifeProTips,ULPT: You can get Free Amazon Prime forever by using the Amazon Family free 30-day trial of Prime. It can be tedious because you have to use new email accounts each month BUT you can use the SAME billing info over and over.
Taco-guy,t3_9unbkn,120,1310,UnethicalLifeProTips,"ULPT: If you're going to speed, do it when it's raining. Cops won't want to pull you over for the fear of getting drenched."
goopystuffs,t3_6nkky5,32,1301,UnethicalLifeProTips,"ULPT: Lie unconvincingly about unimportant things. People will think you're a poor liar, allowing you to fool them more easily over the big lies."
Caustic-Echo,t3_6843vo,30,1295,UnethicalLifeProTips,"ULPT: When you see someone proposing in public, snap a picture on your phone and offer to sell it to the couple afterwards"
senorElMeowMeow,t3_9au2pf,40,1286,UnethicalLifeProTips,"ULPT: write a book claiming to be a retired secret agent, when the agency in question disavows any connection to you, conspiracy theorists will accept you as a real spy and buy your book."
leafninjadog,t3_a03dgh,33,1281,UnethicalLifeProTips,"ULPT: Is your child waiting on a package? When you receive it, hide it before they see it. Every day they will offer to get the mail for you until it ""arrives""."
Breyber12,t3_8arpio,38,1272,UnethicalLifeProTips,ULPT: Enjoy a clean home but hate having to clean? Find yourself a roommate that stress cleans and make their life hell.
Applejaxc,t3_6u9tc7,90,1277,UnethicalLifeProTips,"ULPT: Interested in buying a house but the owners won't come down in price? Try leaving a dead shrew in a curtain rod; once the smell is too unbearable, they'll get desperate and you will know how to get rid of it once you move in"
Derrits,t3_814tm5,42,1261,UnethicalLifeProTips,"ULPT: Job hop too often? Group all of your consecutive short term employment under the flag of ""freelancing"" in your r?sum?."
theWet_Bandits,t3_75c21o,89,1261,UnethicalLifeProTips,ULPT: Does your apartment complex use tokens for laundry? Figure out which brand token they are and buy them online. Do laundry for almost free.
WVAviator,t3_8iy6yn,40,1258,UnethicalLifeProTips,"ULPT: If you want to save money on candy and be antisocial on Halloween, put up a sign that says ""Please take one"" on an empty bowl. Everyone will think you're not home and some rude kids already took all the candy."
Ur_New_PepPep,t3_79cl00,50,1251,UnethicalLifeProTips,"ULPT: When booking a hotel room, book a wheelchair accessible room. It will be larger than a standard room for the same price. The hotel can't ask you about your lack of wheelchair or deny you the room when you check in."
donttelltheboss,t3_71jjuh,28,1244,UnethicalLifeProTips,"ULPT - put an ""out of order"" sign on one of the stalls at work. personal toilet every day"
[deleted],t3_6spcl2,23,1248,UnethicalLifeProTips,ULPT: If you really need money call your oldest relative asking for money from a burner and then next time you see them and they mention it explain phone scams to them
TuckFrigo,t3_8yqrdi,98,1239,UnethicalLifeProTips,"ULPT: Be a girl, be Muslim (you can pretend to be), wear hijab,insert earphones undearneath. Put recordings of important answers and lessons in ipod or phone. Easy high scores in exams."
Tenushi,t3_6xlizb,48,1239,UnethicalLifeProTips,ULPT: Don't want anyone sitting in the seat beside you on public transportation? Bring a bottle of water and pour some on the seat next to you.
TheDerpyAvocado,t3_70v4jy,151,1229,UnethicalLifeProTips,"ULPT: If there is a GameStop near you, check the trash and dumpsters regularly for thrown out games and consoles. You then can go back and sell the games back to them for easy money!"
RaiseChaos,t3_76l2lp,65,1206,UnethicalLifeProTips,"ULPT: Want to find a good free stream of a movie or show? Click ""complaints"" at the bottom of a Google search under the Digital Millennium Copyright Act, it will have a list of links that were removed. Copy and Paste one, and Enjoy!"
The_Nightman_82,t3_8pyuu9,35,1204,UnethicalLifeProTips,ULPT: Always own up to little stupid mistakes. Make a big production out of it. People will begin to trust you and will believe you when you lie to cover a big mistake.
Fearthekoala4,t3_8hr2se,101,1201,UnethicalLifeProTips,ULPT: Register your pets as emotional support animals so you won?t have to pay for pets fees when moving into an apartment.
Gankubas,t3_6n8rl8,30,1197,UnethicalLifeProTips,"ULPT: If you stay at a friend's place who's got pets and you wake up before him not being able to do anything until he/she is up as well, try to get his pet(s) to disturb his sleep. That way, he'll wake up, and you won't be neither bored nor presumed guilty for his/her awakening."
HotTabascoSauce,t3_6vdq5m,87,1191,UnethicalLifeProTips,"ULPT: Need an extension on a paper? Save a copy of your word doc and open it in Notepad++. Delete a large section, save it and email it to your professor. It will appear corrupted and they will just ask you to resend it, giving you time to finish the paper."
hpcisco7965,t3_8lkw19,21,1194,UnethicalLifeProTips,"ULPT: Put fake fallout shelters signs on buildings that do not contain fallout shelters, so that there will be more room for you at the real shelters when the next nuclear war starts."
HighInTheSkyOhMy,t3_68yuny,28,1190,UnethicalLifeProTips,"ULPT: Instead of saying ""I read from on the internet?.."" or ""I saw on facebook?."" Say """"I read in the paper"" or ?I read in the peer reviewed paper?."" you will sound smarter and people will believe you."
asji4,t3_a48o0g,92,1192,UnethicalLifeProTips,ULPT: Ever wonder why your CV/Resume sometimes gets rejected for a job you may be qualified for? Make sure your dates of employment have ZERO gaps even if there was a small gap between your last job or internship
P0wer0fL0ve,t3_6vevni,13,1171,UnethicalLifeProTips,"ULPT: If you're a hooker and a guy wants to take nude photos of you, tell him you're an undercover cop to make him go away"
