author,name,num_comments,score,subreddit,title
LasagnaDotGov,t3_9nlnm7,368,11652,UnethicalLifeProTips,"ULPT: Thirsty and the nearby cafe won't give you water without ordering something? Phrase the request as ""Sorry, could I please have another cup of water?"" and the cashier won't have any basis on which to decline"
WeebonizedAutism,t3_8e488x,217,11627,UnethicalLifeProTips,"ULPT: Do you ever struggle to find the TV remote? If so, while your TV is still under warranty, you can say your remote broke and request a new one for free! Now you have two remotes making it much easier to find one."
LarryTen,t3_aqgr72,303,11612,UnethicalLifeProTips,ULPT: have a library book with a late fee and don?t want to pay it? Put the book back in the shelf at the right place. A couple days later come back and argue that you returned the book awhile ago. They librarian will walk with you and find the book and apologize for the error.
red_skyy,t3_7f2dzu,63,11555,UnethicalLifeProTips,"ULPT: If you?re going Black Friday shopping, be a decent human being &amp; turn your phone horizontal before recording any fights."
kentucky-fried-dicks,t3_bc063v,394,11458,UnethicalLifeProTips,"ULPT If your professor uses a sign-in sheet for attendance, just do random scribbles each day. Then when you miss class, a friend can easily sign you in."
TabascoPissHole,t3_8xxv84,332,11448,UnethicalLifeProTips,"ULPT: Don't want to stand in the security line at the airport? A week before flying call the TSA, tell them you just had surgery and are using a cane. They will meet you at the curb, push you to the front of the line and you skip the hours wait. Had knee replaced in Feb, worked like a charm."
terrestiall,t3_azqxfy,201,11437,UnethicalLifeProTips,ULPT: Whenever theres a celebrity in town try to go and get an autograph or something even if you're not a fan. Real fans living far away pay good money for such items. Ask a friend to take a picture at that time to add authenticity.
Lightningbolt724,t3_8sw8tr,408,11427,UnethicalLifeProTips,"ULPT: Swap the names of your 2 networks around so your family uses the 2.4GHz network and you can use the 5GHz network. The 5GHz network will be displayed as ""2.4GHz"" which puts people off. You then get all the 5GHz networks bandwidth to yourself while your family shares the 2.4GHz network bandwidth"
admiral_pelican,t3_a7mohg,411,11383,UnethicalLifeProTips,"ULPT: if you beat your boss to work, you can say you got there as early as you like."
TooLegitToQui,t3_7qslu8,140,11368,UnethicalLifeProTips,ULPT: Tell your roommates you are allergic to peanut butter so you can eat their peanut butter without suspicion.
[deleted],t3_9o5uw3,360,11331,UnethicalLifeProTips,"ULPT: On the IKEA website, you can order spare parts for free, if you have the 6 didgit code of the part so if you download the pdf of what you want and order parts one at the time, you can get any product for free."
Is_Actually_God,t3_9unewq,249,11320,UnethicalLifeProTips,ULPT: See someone advertising a second hand car that you can't quite afford? Key the car to bring the price down.
lucklikethis,t3_8xm7x9,332,11301,UnethicalLifeProTips,ULPT: Want to find a working download link for a book? Goto the bottom of the google search where the ?removed by DMCA? notice is and find the removal requests. The requests will list the infringing URLs for you.
fighterace00,t3_9c1w05,215,11294,UnethicalLifeProTips,ULPT: Don't change your last name when you get married so you can be each other's professional references
mtrash,t3_b4dy2e,213,11267,UnethicalLifeProTips,"ULPT: When buying home furniture for guests to sit in, buy something somewhat uncomfortable so they wont want to stay too long."
IShitOnYourPost,t3_80pxuw,201,11258,UnethicalLifeProTips,"ULPT: If someone at your company died recently, write yourself a letter of recommendation and sign it as them."
fitzhughwho,t3_aeuuaq,279,11241,UnethicalLifeProTips,"ULPT : Remote start can do more than warm your car up. If you see that you?re about to be towed, but are too far away (in a building), use it. It?ll buy you a few minutes. Most tow places can?t tow a running vehicle unless it?s an emergency."
Chelseaqix,t3_9jwonu,513,11217,UnethicalLifeProTips,ULPT: Instead of giving 2 weeks notice take a week off and start a new job during that time. If things don?t go well you can go back to your original job and no ones the wiser.
RUNROBOTS,t3_74yx8o,302,11207,UnethicalLifeProTips,"ULPT: If you're hungry on a flight and the person next to you is sleeping, order their snacks for them and take them. I'm about to test this in 3 minutes, I'll report back."
king_sting,t3_aryc96,305,11207,UnethicalLifeProTips,"ULPT: Add a plus (+) sign and any word to your gmail address (youremail+save@gmail.com) to fool sites into thinking you?re a new customer, giving you free trials, one-time discounts, and other offers without having to create a new account for each trial/discount."
pattypwhereube,t3_8pskyt,380,11212,UnethicalLifeProTips,ULPT: Need a resume builder? Pick any position you want at a company that is now bankrupt.
Mabepossibly,t3_6zys7p,241,11197,UnethicalLifeProTips,"ULPT: Want to snoop around some place you shouldn't be? Carry a leash with a dog collar clipped to it, say your dog got lose, enlist anyone that questions you to help."
ZraTheGreat,t3_a19ut2,189,11200,UnethicalLifeProTips,"ULPT: if you hit or scratch someone?s car in a parking garage and you see no cameras around, leave an apology note with your ex?s number on it."
james_neutron,t3_bd2vjh,338,11098,UnethicalLifeProTips,"ULPT: Look for unclaimed receipts at ATMs. When you find one with a large balance, put it in your wallet. If you meet a guy or girl that you are interested in, write your phone number on the back of the receipt."
HighTopsLowStandards,t3_8qb507,146,11064,UnethicalLifeProTips,"ULPT: tell your wife and children that you're popping out to get cigarettes and come back in an hour. Increase the time you are gone with every visit. When you eventually desert them, you will have a much longer headstart and be more likely to succeed in your bid for freedom."
deathbeforedownvote,t3_7mkjcn,278,11062,UnethicalLifeProTips,"ULPT: If you faked sick to get out of work today, get really drunk tonight so you look rough in the morning."
SealandStronk,t3_9cohwh,257,11022,UnethicalLifeProTips,"ULPT: If you have a gambling addiction, scam and get banned from every casino available to you. You'll profit massively and won't be able to gamble anymore."
atticuslodius,t3_bgw8at,284,11010,UnethicalLifeProTips,ULPT: Switch out your work?s break room coffee with Decaf so everyone stays tired and you look like a better worker by comparison.
ph3l0n,t3_9vrle0,386,11008,UnethicalLifeProTips,ULPT: Having a house party? Turn the temperature up a few degrees as all the women will strip layers of clothing.
Mr-no-social-skills,t3_afowdm,284,10994,UnethicalLifeProTips,ULPT: Need the answers to your math homework? Look up the name of the math book you use and you can usually find the pdf of the teacher edition with all the answers in it.
askljdhaf4,t3_b8rze3,582,10986,UnethicalLifeProTips,ULPT - Speeding and got pulled over while drunk driving or in possession of narcotics? Call 911 and report gunshots a block or two away. The cop will be called off as that will take priority
brutallamas,t3_8ofmo7,160,10939,UnethicalLifeProTips,"ULPT; If you're sick and don't want to see a Dr, cough or sneeze in your coworkers drink. They will see a Dr and you'll figure out what sickness you have."
_JackStraw_,t3_7df604,246,10915,UnethicalLifeProTips,"ULPT: Take a nap at work? Go into an empty room, close the door, and lie down in such a way that your foot will be hit by the door if it opens. Spill a box of paper clips. If the door opens and wakes you up, you can rise up to all fours pretending that you're picking up the paper clips."
vincest331,t3_6xqjm0,230,10908,UnethicalLifeProTips,ULPT Give homeless people counterfeit money. It?s win win. They?ll either go to jail and be housed or actually be able to spend the money. Either way you look like a generous hero
em_te,t3_9ox1s7,342,10903,UnethicalLifeProTips,"ULPT: No degree? Attend the graduation ceremony of a local university, find a look-a-like student and memorize their name when they?re called on stage, then legally change your name to theirs and tell the Uni you need a replacement cert mailed to your new address."
monkeywelder,t3_b0hb8l,530,10865,UnethicalLifeProTips,"ULPT: Always wear two watches when you go to Wal-Mart. Eventually some old door checker will try and stop you thinking you heisted it, don't stop, as soon as he touches you you're looking at 15k in the bank for him assaulting you. There is nothing illegal about wearing two watches anywhere."
fmanfisher,t3_8qsh62,228,10855,UnethicalLifeProTips,"ULPT: Whenever a coworker mentions a food place that you like, tell them that you've never been there before. They are much more likely to treat you to lunch there now, because it's your ""first time""."
mapperofallmaps,t3_arj7qn,376,10781,UnethicalLifeProTips,ULPT: Can't afford a big diamond engagement ring? Get a Gold/Silver band and say it's a family heirloom passed down many generations
The_Nightman_82,t3_a0707f,279,10747,UnethicalLifeProTips,ULPT: leave a job that had perks at museums or other events? Keep those perks by downloading a PDF of your pay stub and photoshopping the date whenever you need to present it for proof of employment.
depthandbloom,t3_9dzidp,333,10692,UnethicalLifeProTips,"ULPT: Bought something that broke outside the return period? Buy it again from a different company, tell them it arrived defective, then return the first one in the box for a full refund. Brand new exchange for free!"
Shanelw28,t3_92cqnm,284,10650,UnethicalLifeProTips,ULPT: Missed a big meeting or an important school assignment? Go buy a cheap flower bouquet and head to your local hospice. Go to the first elderly lady you see and give her the flowers. Take a selfie with her. When you talk to your teacher or boss show them the pic.
Benalifan,t3_8qhtrt,367,10578,UnethicalLifeProTips,"ULPT: If your wife has a habit that really annoys you, the next time she does it simply say ?it always makes me really horny when you do that?."
TheOmerAngi,t3_b4utl1,187,10543,UnethicalLifeProTips,"ULPT: if you need an excuse to leave school or work, chew up some random food, fill you mouth with water, mix them in your mouth for 20 seconds and then spit it like you throw up. Usually, even if people didn't see you throw up, the mess it leaves really looks like vomit. Easy escape."
sevensidedsilver,t3_7mvzhj,205,10516,UnethicalLifeProTips,"ULPT: Take neighbor's dog for walk for free, take it to college campus/downtown, use it to meet women and get their numbers, feign choking up and claim the puppers died when they ask."
Robotjoey81,t3_azf62a,384,10505,UnethicalLifeProTips,ULPT: Single and lonely? Or just want to get laid? Pose as a sex addict and join SAA (sex addicts anonymous). It is a great way to meet people that are easy to get in bed.
DeadManInc1981,t3_aw5vah,377,10500,UnethicalLifeProTips,"ULPT: When ordering Mcdonalds through their self service during busy periods, order an ice cream too. This will bump your order to a priority slot enabling you to receive your order quicker."
AirlineShift,t3_aluqah,144,10480,UnethicalLifeProTips,"ULPT: if you are traveling for work and something at the hotel is not satisfactory, ask for loyalty program points as compensation, not a discount or refund. Discount goes back to your company. The points stay with you. After all, you had the inconvenience that warrants the points, not your boss."
ceyeyayo,t3_9adkvq,318,10445,UnethicalLifeProTips,ULPT propose to the woman of your dreams with a fake diamond ring. If she rejects you tell her its fake anyways. If she accepts it then dont say anything. If she finds out its fake tell her you dont believe in blood diamonds and african slave labor. If its true love she will understand.
IX0YE,t3_9htfqv,339,10414,UnethicalLifeProTips,"ULPT: Are you regretted for not having an abortion? Do you want to get rid of your kid legally? Simple, just don't vaccinate your kid and let nature take its course. The law can't get you if your kid died."
TrumpFan420HDTV,t3_9v14r1,314,10403,UnethicalLifeProTips,"ULPT: Saying you have a colon disease gets you out of work, lets you run late to tests, and rarely results in any questions due to it being embarrassing. No faking visible symptoms either."
botetta,t3_98bs7h,546,10402,UnethicalLifeProTips,ULPT: Mine cryptocurrencies in hotels. You don't have to pay the electricity bill there.
Onphuuno,t3_8iw7v3,343,10318,UnethicalLifeProTips,ULPT. Keep an old parking fine ticket with you so if you need to park illegally you can put the ticket under your windscreen wiper so the parking inspectors will think you?ve already been marked!
MD3428,t3_8mhwpi,348,10280,UnethicalLifeProTips,ULPT: Want to prevent rent from increasing? Collect some old sneakers and hang them on power lines in your neighborhood.
Shkotz,t3_bec7xf,416,10245,UnethicalLifeProTips,"ULPT: If you're locked in a gym contract, at LA Fitness, and maybe other major gyms, and don't want to pay the termination penalty. Simply update your billing info to a gift card that has at lease a $1 balance. When they try to charge your monthly balance, it will get declined."
Themurdman,t3_95msye,579,10232,UnethicalLifeProTips,"ULPT: If you?re drunk and a subscriber to triple a (AAA) and don?t want to drive your car home, or leave it wherever you are, call AAA and have them tow it to your house and ride along with the driver."
[deleted],t3_9x8bbj,350,10221,UnethicalLifeProTips,ULPT: It's easier to get approval for an abortion if you say you're not sure if the child is your brother's or your father's.
lokicoyote,t3_9lldqm,771,10181,UnethicalLifeProTips,ULPT: Can't purchase mace where you live? Just use gold spray paint--it's blinding and will make it easier for the police to identify your attacker.
Doomsdayrs,t3_b2uwl0,381,10177,UnethicalLifeProTips,"ULPT: Can't afford things at Walmart? Convince the Walmart employees to form a union and go on strike. Walmart will immediately close down the store in the area, and may have a clearance sale."
CalibanDrive,t3_6yvxc5,346,10167,UnethicalLifeProTips,ULPT: Pour cheap wine into expensive wine bottles to serve to your guests in order to make them think you are serving them expensive wine. They will legitimately enjoy wine more that they think is expensive.
Bdogg242,t3_7dmmk4,162,10159,UnethicalLifeProTips,"ULPT: Write the full name of someone you hate on your body everyday in permanent marker that way no matter how or when you die, they'll become a suspect"
[deleted],t3_7xqvsf,155,10130,UnethicalLifeProTips,"ULPT If you're feeling alone and isolated, carry around birthday balloons with you and watch as random strangers smile at you and even wish you a happy birthday. Best part is it doesn't even have to be your birthday."
MonteInVirginia,t3_7arjqk,151,10122,UnethicalLifeProTips,"ULPT: If you?re a woman and can?t keep up with your housework, pretend you have cancer. There is an organization in the U.S. and Canada that will come to your house and clean it for free."
AnonUserAccount,t3_99e9km,364,10125,UnethicalLifeProTips,"ULPT: When applying for a new credit card that offers a reward for spending a specific amount in the first 2/3 months, you can always purchase gift cards to your favorite stores in order to meet the minimum amount to earn the reward"
BoomChocolateLatkes,t3_a2wno5,398,10119,UnethicalLifeProTips,"ULPT: find and bookmark a few porn videos that most closely match the sex you have with your SO. That way if they ask what kind of porn you watch, you can confidently pull up something acceptable instead of offending them with the sick shit you normally watch."
Musicferret,t3_8d7uj2,153,10111,UnethicalLifeProTips,"ULPT: Next time you come home stinking drunk and your spouse tries to have sex with you, yell ?Stop! I?m married!? to gain lvl. 1000 trust from them forever."
mewantcookie83,t3_88qb4p,121,10044,UnethicalLifeProTips,ULPT: Next year get blackout drunk before you hide the kids Easter eggs. Finding them the next day will be fun for you too since you won't remember where they are.
danilohrf,t3_ac66a1,302,10018,UnethicalLifeProTips,ULPT - The fastest way of canceling/getting a refund at an online subscription is saying you got fired and need the money
clamantmonster,t3_8f43wz,385,9996,UnethicalLifeProTips,"ULPT: Need to look like you are online at work? Fire up a PowerPoint in presentation mode and you will never show an ""away"" status."
stoll33,t3_8o1vou,566,9972,UnethicalLifeProTips,ULPT: Carry around a 100$ bill and order a coffee from Starbucks. They do not accept 100$ bills but your coffee will be made and you will get it for free.
_hiterally_litler_,t3_72ed62,637,9964,UnethicalLifeProTips,"ULPT: If you total your car while drink-driving, just leave it and go home. The next morning, report it stolen and file a police report. You'll avoid charges and get a new car from insurance."
Sophism,t3_6joxb9,527,9948,UnethicalLifeProTips,"ULPT: If you want to dine and dash at a restaurant, take the bill with you and leave a tip."
FlatOutEKG,t3_b7biti,200,9890,UnethicalLifeProTips,ULPT Girl night out and want free drinks? Make one of your friends wear a bride to be sash. You'll get free drinks like crazy. The better you dress up the more drinks you'll get.
VeryAverageWhiteMale,t3_b6vx42,302,9865,UnethicalLifeProTips,ULPT Need to raise cash? Open up a homeless shelter in a wealthy area and the community will pay you not to
TobiasWade,t3_8x8ayo,154,9853,UnethicalLifeProTips,"ULPT Avoid people without offending them by sending a text on Airplane Mode. The text will fail to send, and you can show them later and pretend that you tried."
PM_DOG_PICS_,t3_be0c9i,159,9824,UnethicalLifeProTips,"ULPT: For classes with a curve, write a ratemyprof at the beginning of the semester you?re taking it, telling incoming students ?class isn?t mandatory, and you don?t really need to study? so that the curve works out in your favor if they take your advice and then fail."
LuckyBlackCat,t3_7kgfqu,281,9815,UnethicalLifeProTips,ULPT: Keep good driving habits when you?re sober and they?ll carry over after you?ve had a few.
twows995,t3_axqhai,499,9790,UnethicalLifeProTips,"ULPT: Keep a bag with a change of clothes in your car. If you're coming out of the pub drunk and a cop sees you stumbling to your car, just say you were retrieving the bag and was going to stay over at a friends house instead of driving."
StealYourBanana01,t3_7ye67y,256,9778,UnethicalLifeProTips,ULPT: Need a free Taxi ride? Tell the driver to go somewhere further away than your destination. When you are close to your destination tell them you have no money and you'll be kicked out at where you need to be!
idrinkh20frombottles,t3_82v6r3,404,9779,UnethicalLifeProTips,ULPT Can't afford STD testing? Just sleep with someone who has health insurance then tell them to get tested.
fredandlunchbox,t3_axgd7g,158,9764,UnethicalLifeProTips,"ULPT: Selling something on craigslist? Make a few ads with different photos for prices way above your asking price and then post your item. It'll be easier to sell if it's the cheapest one on the site, even if the others are a little overpriced."
obartsh27,t3_7930c1,205,9766,UnethicalLifeProTips,"ULPT: If you need cash, kidnap the neighbor's dog. Then when they post a lost dog poster out with a reward, claim your $50 prize!"
fischarcher,t3_7cnbob,167,9747,UnethicalLifeProTips,"ULPT: If you're a game developer and people are getting feed up with you selling half the game as dlc, start claiming that you're going to give out the dlc for free and charge microtransactions for base content."
lkodl,t3_bmfal4,136,9748,UnethicalLifeProTips,"ULPT Greeting Cards: at the store, find a card with a message that you really like. then, buy a cheaper card with a generic/blank message, and write in what was in the first card. it will look like you came up with a really thoughtful message."
Jigga_Justin,t3_8hcgym,405,9678,UnethicalLifeProTips,"ULPT: Server ignoring you hardcore when you?re trying to get your check and pay the bill? Drop a glass/plate onto the floor, the shattering glass will bring them to your table instantly."
addiemac21,t3_an2y3o,437,9659,UnethicalLifeProTips,ULPT: Need money not now but in a few months? Search for open class action suits and fill them out. I just got $50 after 4 months for probiotics I've never bought.
Sylocule,t3_8v8z9y,359,9611,UnethicalLifeProTips,"ULPT: If you?re a doctor faced with an anti-vaxxer, tell them the new MMR vaccine has an autism vaccine included."
Skydiever,t3_9tqf7z,230,9609,UnethicalLifeProTips,ULPT: Find a business near a major sports event. Strip malls are best. Stand in the entrance to the parking lot. People will ask you how much to park there. $10-$20 or more depending on how big the event is. The owners will usually not be there or at the game. Leave before getting greedy or caught.
Miserably_miserable,t3_bkxnlg,293,9589,UnethicalLifeProTips,"ULPT: Got some expired food in the house? Just buy more of the same thing, then return to the store with your receipt and the expired product and say it was expired when you bought it."
realdeal64,t3_951kze,176,9560,UnethicalLifeProTips,ULPT: Install a small GPS tracker on fishing guide boats so you can learn the good fishing spots.
jdsquint,t3_91tfx3,140,9560,UnethicalLifeProTips,ULPT: Spouse feeling down? Discreetly calibrate your bathroom scale with a 5lb weight to give them a quick self-esteem boost!
Cucubert,t3_b1txm8,421,9545,UnethicalLifeProTips,"ULPT If a customer is hassling you about something you can't/won't do, always blame it on something outside your control"
Dariszaca,t3_7ch3qd,205,9544,UnethicalLifeProTips,"ULPT: Never lie about little things, people will think you are really honest until you need to tell a big lie and people will believe it"
Troll3Killer,t3_7octvp,467,9531,UnethicalLifeProTips,ULPT Don't want to pay tax for games on your Nintendo Switch? Just change your zip code to one in Oregon! Then you will get games tax-free!
Normallybored,t3_9nt896,261,9451,UnethicalLifeProTips,ULPT Starved for human affection? Pretend you?re choking at a restaurant until someone performs the Heimlich maneuver on you for an improvised hug.
Brucebeat,t3_9jcn8u,332,9449,UnethicalLifeProTips,ULPT: Want to get checked by a doctor and don?t have health insurance? Apply to jobs that require a physical.
clinkyscales,t3_7e25rl,305,9436,UnethicalLifeProTips,"ULPT: Get a job at a pizza chain (dominos, Pizza Hut, etc) keep the uniform, bag, and topper when you quit. People will literally let you in anywhere. Also the topper will let you get away with parking anywhere."
dandan2110,t3_bjbodq,388,9426,UnethicalLifeProTips,"ULPT: Hate paying for refunds on Amazon? Go to customer service chat and give them the ""I didn't know there wasn't free refunds and I'm very upset"" They will always give you the ""However, in this case to serve you better, as an one time exception, Ill help you with a return label to return the item"""
RunickFire777,t3_9yq059,446,9389,UnethicalLifeProTips,ULPT: Go to a store the day before Black Friday and hide an item in an area of the store that no one would shop near on Black Friday. Go find your item the next day and avoid fighting with other customers.
Supes_man,t3_8vxs29,328,9375,UnethicalLifeProTips,"ULPT: Want to make sure people listen to you? Begin your sentence with ""I'm not racist, but..."" then say your thing."
PearlWhitecrow,t3_alnv9m,487,9313,UnethicalLifeProTips,"ULPT: When grocery shopping, pop the stems off of costly but delicious Portobello mushrooms before bagging and buying them. The stems weigh as much or more as the caps but most people don't eat them. More mushroom deliciousness for less money."
Reecezwoos,t3_blde8k,379,9281,UnethicalLifeProTips,"ULPT: When you see a police car fly by you with their lights on, follow them and enjoy the free police escort"
SweetPotato696,t3_anqc9k,351,9266,UnethicalLifeProTips,ULPT: Tired of stopping at gas stations that won?t let you use the restroom unless you?re a paying customer? Always park at a pump and say you?re getting gas after.
Cryptoprocta42,t3_9ryon5,291,9258,UnethicalLifeProTips,ULPT: Want the council to clean graffiti off your house? Add something obscene or racist to it
ZunaCorpLX,t3_9w5jn3,368,9241,UnethicalLifeProTips,"ULPT: If you have an online class with online tests, buy an online textbook or Ebook. Use ctl+F to search for keywords in the questions or answers while taking the test."
sjt112486,t3_9cc7q9,184,9242,UnethicalLifeProTips,"ULPT: If you need to cancel a hotel reservation but are already passed the free cancellation window, call and push the reservation out to further in the future then call the next day to cancel for free."
UnfairCorner,t3_a76prs,285,9174,UnethicalLifeProTips,"ULPT: If you have two pets of the same breed and colour, you only have to get pet insurance for one."
HelmKiller,t3_bicb6t,226,9171,UnethicalLifeProTips,ULPT When you get receipt from Mcdonalds there is an offer where you get a discount for a big mac meal if you do a questionaire. At the end you'd get a code but you can write any combination of numbers on the blank spaces on the receipt they won't check the code anyways.
Pythnator,t3_9xsw8e,761,9144,UnethicalLifeProTips,"ULPT: If you?re an American traveling abroad, put a Canadian flag somewhere on your clothes. People will be more apt to help a Canadian tourist as they?re believed to be nicer."
tetsuo52,t3_7fvu95,800,9032,UnethicalLifeProTips,ULPT Being accused of mansplaining? Explain to them that you are non-binary and shame them for assuming your gender.
